"RT @jeremycorbyn: After yesterday’s European referendum, politicians of all parties must listen to and respect the outcome of the vote http…"
RT @jeremycorbyn: Thanks to the thousands of Labour activists who've been campaigning &amp; making the #LabourInForBritain case for Remain http…
"Thanks to all who supported #LabourInForBritain. Join our growing movement here: https://t.co/lh6Qo3p7xQ
https://t.co/VFibfyg8oK"
"For your incredible support &amp; hard work, thank you to everyone who's helped with the #LabourInForBritain campaign. https://t.co/haxYSqhlbz"
"Polling stations are open until 10pm. If you're in the queue by 10pm, you'll be able to vote https://t.co/8u0Vr5Uy9R https://t.co/TMfnkHirBd"
"RT @ElectoralCommUK: Polling stations are open until 10pm. If you are in the queue by 10pm, you will be able to cast your #EURef vote"
This is your LAST CHANCE. Vote before 10pm to have your say #LabourInForBritain #EUref https://t.co/8u0Vr5CWLh https://t.co/gPHYqU9Tvr
"RT @SadiqKhan: Door to door, street to street - we'll keep campaigning across our city until 10pm. One hour to go! #StrongerIn https://t.co…"
Voted Remain today? Great! Now share this ↓ #LabourInForBritain #EUref https://t.co/TLo53jSr8y
Don't miss out on your chance to vote today. Polls close at 10pm so RT to remind others #LabourInForBritain #EUref https://t.co/RVEkqJsdHk
This is the choice of a generation. You can still be heard but there's not long left. GO → https://t.co/8u0Vr5CWLh https://t.co/nZkFrJGYV1
"Have you voted yet? Polls are still open, so head on down and vote Remain before 10pm #EUref #LabourInForBritain https://t.co/lFvxYVLHPK"
RT @UKLabourIN: Just 2 hours left to vote Remain says Labour's Deputy Leader @tom_watson! #LabourInForBritain https://t.co/1LtYFusioX
There's TWO HOURS to go. You can still be part of this historic decision – go vote now: https://t.co/8u0Vr5CWLh https://t.co/rcIjnNWrq4
"This is the last push before polls close at 10pm so make it count. If you voted Remain today, share this ↓ #EUref https://t.co/vulw4JCU3n"
"Your plan to vote:
1. Find your polling station → https://t.co/8u0Vr5CWLh
2. Go vote
#EUref #LabourInForBritain https://t.co/YhhJgx98FQ"
"Already voted Remain? ✓
Let people know to remind them to do the same. SHARE THIS ↴
#EUref #LabourInForBritain https://t.co/BZX0Wd2rx8"
"RT @jeremycorbyn: 800k people have watched this video but everyone should know our NHS is at risk if we vote Leave #LabourInForBritain
http…"
Heading home? There's still plenty of time to vote – find where you need to go → https://t.co/8u0Vr5CWLh #EUref https://t.co/clPIpxWEHb
RT @akhanmep: Huge team out from @WithingtonCLP this evening #LabourInForBritain  #VoteRemain https://t.co/kqT0Mh41Lu
Millions of people are taking part in this decision of a lifetime. Don't miss out #EUref #LabourInForBritain https://t.co/UL8vgjP6VJ
"There will be no going back if we leave. 3 million jobs are at stake. Watch, share, and vote Remain:
https://t.co/8RJHEYIwTY"
"If you've already voted, thank you.
Now tell everyone to do the same - SHARE THIS ↴
#EUref #LabourInForBritain https://t.co/Du8XP3EC0Z"
"Today, our future will be decided by the millions casting their votes. Know where to go? https://t.co/8u0Vr5CWLh https://t.co/Mz7UyMlqIN"
Only a Remain vote will protect British jobs and our economy. Make sure your ballot's in #EUref #LabourInForBritain https://t.co/b6pzMWHmPP
"Voting Remain to protect our NHS &amp; vital services from threats of extreme cuts? SHARE ↴
#EUref #LabourInForBritain https://t.co/UhEr3XbMha"
"Voting Remain for better consumer protection, lower roaming costs &amp; cheaper medical care in Europe? SHARE ↴ 
#EUref https://t.co/OUGxBRKtLt"
"Voting Remain to maintain minimum paid leave, parental leave, and anti-discrimination laws? SHARE ↴
#EUref https://t.co/MPfC8LJJLy"
"Voting Remain to protect 3 million British jobs &amp; access to the largest single market in the world? SHARE ↴
#EUref https://t.co/JhQwvkq8vB"
"""Britain is better off in Europe. Vote Remain."" – @jeremycorbyn. Watch and share now ↓
#EUref #LabourInForBritain
https://t.co/FWkb3BIQGw"
"To protect millions of jobs, our exports &amp; our hard-won workers' rights, vote Remain today #LabourInForBritain RT ↓ https://t.co/IMgKQrfO08"
RT @InForWirral: Lots of West Kirby commuters intending to vote REMAIN #LabourInForBritain https://t.co/fCxzFDHFV7
RT @HanLP: Ice cream break during busy @exeterlabour #labourdoorstep #LabourInForBritain https://t.co/K6yxrHv9Rg
RT @TheresaMEP: We're in Manchester! Heading out with a great team from @WithingtonCLP and @McrLabour! #LabourInForBritain #EUref https://t…
RT @UKLabourIN: Peckham is voting to Remain! Great stop with Harriet Harman. #LabourInForBritain https://t.co/li2aXcIWsx
RT @JamesABolton: Team Hoxton going out on another round! #LabourInForBritain #StrongerIn https://t.co/4bO8MWNPl6
Voted Remain today? Great! Now share this ↓ #LabourInForBritain #EUref https://t.co/fEPQZlcskk
"TODAY: Vote Remain for jobs, workers' rights, lower prices &amp; our NHS, then share this ↓ #EUref #LabourInForBritain https://t.co/AOdeINuvfa"
"If you're voting Remain today to protect our NHS and public services from a hit to the economy, RT ↓ #EUref https://t.co/t2yqoyLEbR"
"If you're voting Remain today for lower prices on cars, holidays &amp; the weekly shop, RT ↓ #EUref #LabourInForBritain https://t.co/5UK6unVQPX"
"If you're voting Remain today to protect the workers' rights we all depend upon, RT ↓ #LabourInForBritain #EUref https://t.co/kMwAJTpCOH"
"If you're voting Remain today to protect three million jobs which depend on our EU trade, RT ↓
#LabourInForBritain https://t.co/QBu7lwNHoP"
"If you voted Remain today, you have just one thing left to do: share this ↓ #LabourInForBritain #EUref https://t.co/ouytH7xs80"
Don’t put our jobs and economy at risk: vote Remain today #LabourInForBritain #EUref https://t.co/8RJHEYIwTY
"SHARE THIS: for jobs and workers' rights @jeremycorbyn is urging you to vote Remain today. #LabourInForBritain 
https://t.co/FWkb3BIQGw"
"RT @LGBTLabour: It's #EUreferendum day. The #EU is promoting, defending &amp; extending #LGBT rights across Europe. Vote #Remain https://t.co/B…"
"RT @SadiqKhan: For jobs, for workers rights, and a better future with more opportunities for our city &amp; country #Ivoted #StrongerIn https:/…"
"Remain = workers' rights are safeguarded. 
Leave = our rights are in the hands of the Tories. 
Vote Remain and RT ↓ https://t.co/3wp2BC2AWb"
"RT @jeremycorbyn: Knocking on doors to make sure labour supporters vote remain for jobs, workers' rights &amp; our NHS #LabourInForBritain http…"
"If you voted Remain today, share this and spread the word ↓ #EUref #LabourInForBritain https://t.co/jQpvsi4IPE"
"Today is the day: Vote Remain for jobs, workers' rights, lower prices and our NHS #EUref #LabourInForBritain https://t.co/Bdexey3X1k"
"For lower prices on holidays, cars &amp; the weekly shop which the EU gives us, vote Remain today &amp; share this ↓ #EUref https://t.co/lyD7bsLHoB"
"To protect our NHS and vital services from a hit to the economy, vote Remain today and share this ↓ #EUref https://t.co/N2oHV8cFJ2"
"For hard-won workers' rights which the EU safeguards, vote Remain today and share this ↓ #EUref #VoteRemain https://t.co/4FnpQUSNBb"
"For three million jobs which depend on our exports to the EU, vote Remain today and share this ↓ #EUref https://t.co/HIxQVAxa2x"
"Looking for some facts, or trying to persuade a friend to vote Remain? Take a look here → https://t.co/TyVnSxYJGP #EUref #LabourInForBritain"
RT @jeremycorbyn: I've just voted to Remain. The EU provides the best framework to meet the challenges of our time #LabourInForBritain http…
"Watch &amp; share: vote Remain to protect jobs and £220bn worth of exports a year to the UK economy #LabourInForBritain
https://t.co/8RJHEYIwTY"
"You have until 10pm tonight - for jobs and workers' rights, make sure you vote Remain today #LabourInForBritain https://t.co/1yeSqMuFJ9"
"If you're an early bird and you've already voted Remain today, share this ↓ #LabourInForBritain #EUref https://t.co/DeAr4x6knv"
"Today @jeremycorbyn is urging everyone to vote Remain. If you're with him, share his message ↓ #EUref #VoteRemain
https://t.co/FWkb3BIQGw"
Not sure where your polling station is? Find out now → https://t.co/8u0Vr5CWLh #LabourInForBritain #EUref https://t.co/RDGjparI1q
"To do today: 
1. Vote Remain in the #EUref 
2. Share this ↓ 
#LabourInForBritain https://t.co/gW44TlrSnf"
On the ballot paper this Thursday: British jobs and future prosperity #C4Debate https://t.co/tbzmNrMFST
"It's this Tory Government holding Britain back, not the EU. If you agree with @jeremycorbyn, share this #c4debate https://t.co/XBnA2uG5YC"
The European Arrest Warrant means that we can arrest criminals across the EU. We could lose access to this warrant if we left #C4Debate
"""I want my children's children to enjoy the kind of life that we've had” &lt; WW2 veteran John’s moving video https://t.co/oYhq8nqI5a #c4debate"
"Being in Europe helps keep costs down on everything from passenger air fares, to mobile phone roaming charges #C4Debate"
"Almost half of our exports go to EU countries, supporting jobs across Britain. #C4Debate #LabourInForBritain"
Voting Remain tomorrow? Share this and pledge your support ↓ #LabourInForBritain https://t.co/ReO2uKfwKw
. @jeremycorbyn and trade union leaders representing 4 million workers are united: Vote Remain. #LabourInForBritain https://t.co/h6Z5Bgy8mp
"The Labour family has been busy spreading the word about why we're voting Remain. Take a look ↓ #LabourInForBritain
https://t.co/gMMu8T4Wqd"
"It's almost time - make sure you vote tomorrow 7am-10pm. If you're voting Remain, share this ↓ #LabourInForBritain https://t.co/ydLqZEjv0h"
Don’t put our jobs and economy at risk: vote Remain tomorrow #LabourInForBritain https://t.co/0jNsg3ef5z
SHARE: for jobs and workers' rights @jeremycorbyn is urging you to vote Remain tomorrow. #LabourInForBritain https://t.co/15shxv6Gyw
"To achieve change across the EU, we must Remain and Reform, says @jeremycorbyn. RT if you agree #LabourInForBritain https://t.co/BLJAwn4Knk"
Let’s not risk millions of jobs and billions worth in exports. RT this ↓ #LabourInForBritain https://t.co/0jNsg3ef5z
"The #EUref put jobs, workers' rights, economy &amp; NHS on the ballot paper, says @jeremycorbyn RT ↓ #LabourInForBritain https://t.co/15shxv6Gyw"
"For jobs, workers' rights, lower prices &amp; the NHS: vote Remain tomorrow. RT ↓ #LabourInForBritain https://t.co/TW2W6fmGYk"
"Better for jobs, rights, security &amp; Labour values: @SadiqKhan urges voters to Remain tomorrow #LabourInForBritain https://t.co/Qu9xaWf0HI"
"Let's stay in, stay strong, and stay together says Carwyn Jones @fmwales. RT if you agree ↓ #LabourInForBritain https://t.co/u2rXUqnfGK"
"The EU secures jobs and our rights - don't throw it all away, says @kezdugdale RT ↓
#LabourInForBritain https://t.co/tMGOzCIenr"
"We can protect jobs, defend workers' rights &amp; safeguard our NHS if we Remain, says @jeremycorbyn #LabourInForBritain https://t.co/Nl40YvYvn3"
"For our NHS, @jeremycorbyn is voting Remain tomorrow. Share his message ↓
#LabourInForBritain https://t.co/0p5GmmtmJB"
3 million jobs &amp; £220 billion in exports are on the ballot paper. Don't risk them: vote Remain. #LabourInForBritain https://t.co/0jNsg3ef5z
Voting Remain tomorrow? Us too. Share this ↓ #LabourInForBritain #EUref https://t.co/ZPXg4mOXxl
RT @UKLabourIN: I urge you tomorrow to vote to Remain - @jeremycorbyn https://t.co/iUalEKQha4
"RT @labourpress: Vote for jobs, vote for the NHS, vote for rights at work @jeremycorbyn #LabourInForBritain #EUref https://t.co/R6yAfJTQkN"
"RT @UKLabourIN: Jeremy Corbyn: By voting to Remain we can protect jobs, defend workers' rights &amp; safeguard NHS. #LabourInForBritain https:/…"
RT @labourpress: Labour's national leaders at eve of poll 'Rally for Remain' #LabourInForBritain #EUref https://t.co/WLWvr0WPOF
"RT @UKLabourIN: Sadiq Khan: We're here to make strong, positive &amp; Labour case for Britain remaining in EU. #LabourInForBritain https://t.co…"
"RT @UKLabourIN: Sadiq: vote for jobs, rights at work. This is the fight of our lives. Let's win this. #LabourInForBritain https://t.co/QFWI…"
Watch Labour's leaders @jeremycorbyn @SadiqKhan @kezdugdale and @fmwales LIVE from 2pm today: https://t.co/G5kNHgZVIc #LabourInForBritain
Labour leaders @jeremycorbyn @SadiqKhan @kezdugdale @fmwales will be LIVE today from 2pm. Watch: https://t.co/G5kNHgZVIc #LabourInForBritain
"Tomorrow: vote for jobs, workers' rights, lower prices and the NHS. Vote Remain. #LabourInForBritain https://t.co/dntQN9ml9A"
Almost three million jobs are linked with our trade to Europe - we can't put them at risk. #LabourInForBritain https://t.co/0jNsg3ef5z
RT @UKLabourIN: Second stop of the day is Derby. #LabourInForBritain https://t.co/enm49GyHk2
"For the economy, workers' rights, the NHS... Here's why Janet is voting Remain tomorrow #LabourInForBritain #EUref https://t.co/Ojf5oxVSkm"
"We can't put our jobs and exports at risk - for a strong economy, Jo is voting Remain tomorrow #LabourInForBritain https://t.co/UADsurLzmr"
"We asked our supporters why they're voting Remain tomorrow, here's what Yvonne said ↓ #LabourInForBritain #EUref https://t.co/NJqqKTfyWa"
"SHARE THIS: for jobs and workers' rights @jeremycorbyn
is urging you to vote Remain tomorrow. #LabourInForBritain
https://t.co/15shxv6Gyw"
"If you want a fairer and more just world, vote Remain tomorrow. Share @jeremycorbyn's message ↓ #LabourInForBritain https://t.co/2Lnsf2e5cc"
Not sure where your polling station is? Find out now → https://t.co/8u0Vr5CWLh #LabourInForBritain #EUref https://t.co/JavMcSwJIH
We can't afford to put our hard-won workers' rights in the hands of the Tories. #LabourInForBritain #VoteRemain https://t.co/0ZHqQ2Ko3I
"RT @UKLabourIN: First stop of the day is Sheffield with Hilary Benn MP, Paul Blomfield MP &amp; Linda McAvan MEP. https://t.co/2tWglV3NUn"
"Jobs, workers' rights, the economy, and the NHS are on the ballot paper, says @jeremycorbyn #LabourInForBritain RT ↓
https://t.co/15shxv6Gyw"
Voting Remain tomorrow? RT this ↓ #EUref #LabourInForBritain https://t.co/S8jbfgNDw4
"Protect jobs and £220bn worth of exports a year to the UK economy - vote Remain tomorrow &amp; RT #LabourInForBritain
https://t.co/0jNsg3ef5z"
Today would have been Jo Cox’s birthday. Find an event near you to honour her life: https://t.co/pB3EwpJJ2o #MoreInCommon
"RT @jeremycorbyn: Tomorrow I'll be voting Remain: for workers' rights, our NHS &amp; for jobs. Join me by changing your profile picture → https…"
Join @jeremycorbyn and change your profile picture on Facebook and Twitter to show your support #LabourInForBritain https://t.co/GyGn7oEFqA
"RT @UKLabourIN: Today, Labour leaders past &amp; present campaigned across the country for a vote to Remain. Agree with them? RT. https://t.co/…"
"Not sure where to vote tomorrow? Find your polling station now → https://t.co/8u0Vr5CWLh 
#LabourInForBritain https://t.co/yd8MOaQdGN"
Tomorrow we're voting Remain. RT if you'll be putting a ✗ in the Remain box too ↓ #EUref #LabourInForBritain https://t.co/LK5eeUc7d7
"This vote puts Britain’s jobs, workers’ rights, the economy &amp; the NHS on the ballot paper - vote remain #BBCDebate https://t.co/n5SFIs1OaJ"
Say you're IN for Britain with @jeremycorbyn. Vote Remain on 23 June and share this → #BBCDebate https://t.co/n5T9oufsxy
"340,000 women every year have guaranteed rights to maternity leave, thanks to the EU #BBCDebate https://t.co/1LCu2Nug0I"
"""Don't quit, we're better than that!” RT if you agree with @SadiqKhan #BBCDebate"
"The European Arrest Warrant has led to over 1,200 suspected criminals being arrested &amp; returned to Britain to face justice #BBCDebate"
"RT @jeremycorbyn: Jo Cox would have been 42 tomorrow &amp; people are planning to gather in Trafalgar Sq. to celebrate her wonderful life.
http…"
Former MI5 &amp; MI6 chiefs say leaving EU would hamper “our ability to protect ourselves” from terrorists #BBCDebate
The safer option is to stay in the EU and work with our neighbours to address challenges together. #BBCDebate https://t.co/wSzBfhlt9N
"Over 8,600 suspected criminals &amp; terrorists have been removed from the UK since 2004 thanks to the European Arrest Warrant #BBCDebate"
The European Arrest Warrant means that we can arrest criminals across the EU. We could lose access to this warrant if we left EU #BBCDebate
Spot on from @FrancesOGrady “There’s nothing patriotic about putting people’s jobs at risk” #BBCDebate https://t.co/RWPZBq9L6G
"It's this Tory Government holding Britain back, not the EU. If you agree with @jeremycorbyn RT #BBCDebate https://t.co/MKH7xnJTRq"
Britain’s EU membership gives us a seat at the top table and a stronger voice on the world stage #BBCDebate
"Let's ensure that Britain remains Great. For jobs, growth, security, workers' rights vote Remain. #BBCDebate https://t.co/FpMQbis9f8"
"RT @labourpress: Diane James claims Farage ""has apologised"" for UKIP immigration poster. Has he? Where? Assume he will be happy to do so no…"
Our economy would be badly damaged if we leave the EU and that means more austerity &amp; bad news for NHS. https://t.co/ADHOWJpvvo
"Sadiq dismantling Leave arguments: ""How is it having more control if young people are stifled of the opportunity that we had?"" #BBCDebate"
Being in Europe helps Britain control immigration - through EU we persuaded France to move our border from Dover to Calais #BBCDebate
"RT @BBCNews: Leave campaign ""hasn't been project fear, it's been project hate"" - @SadiqKhan #BBCDebate https://t.co/slOCKdj5NP https://t.co…"
Misleading for Leave campaign to say Turkey will soon join EU – it’s nowhere near &amp; UK has veto #BBCDebate https://t.co/SgRw7AO3kx
A vote to leave is a vote to put the NHS in the hands of those who can’t be trusted with our NHS #BBCDebate https://t.co/oIzxyZGtLr
Jeremy Corbyn is urging everyone to vote Remain to protect our NHS  #BBCDebate #LabourInForBritain https://t.co/wrWRjg5h7D
"Leaving the EU wld be bad for the NHS: it wld hit the economy, meaning less money &amp; threatening further Tory cuts #BBCDebate"
"Michael Gove admitted if we Leave EU he “can’t guarantee every person currently in their current job will keep their job."" #BBCDebate"
A weaker economy means we’ll have less money to spend on key public services like the NHS #BBCDebate
The Leave campaign want to have a bonfire with our workers’ rights – don’t let them. Vote Remain on 23 June. https://t.co/6dNjLSK4Oe
"Michael Gove has admitted if we Leave EU he “can’t guarantee every person in their current job will keep their job."" #BBCDebate"
According to @CBItweets we get far more out of Europe than we put in – a return of almost ten to one #BBCDebate https://t.co/nIDbT1pey5
"A Tory Brexit would be a disaster for working people in Britain, says @jeremycorbyn. Agree? RT → https://t.co/pGe9hbOe3V"
Boris Johnson in 2012: “scrap the social chapter” - which gives us rights at work https://t.co/wtyMtoUTUF #BBCDebate https://t.co/ZrVn4Sn0Lx
Leave campaign want to ‘halve the burdens’ of our employment rights #BBCDebate https://t.co/0bnUGIK4js
Leave campaign should come clean - which workers’ rights would they scrap if we left Europe. Petition: https://t.co/EAusJsmO10 #BBCDebate
Over 26 million British workers are entitled to 28 days of paid leave thanks to EU directives https://t.co/5TENfImxBP
The EU safeguards vital workers' rights we rely on­ which would be in the hands of the Tories if we left #BBCDebate https://t.co/ACmONc0RoO
On the ballot paper this Thursday: working people’s hard won rights #BBCDebate
Len McCluskey: vote remain and for British workers to build their future in unity in Europe https://t.co/qNdxwpmSqN
"The EU is the largest single market in the world and over 200,000 British companies export there tariff-free #BBCDebate"
Trade deals currently being negotiated by the EU could boost UK exports by up to £40 billion #BBCDebate
What Leave campaign won’t admit: 9 out of 10 economists agree that leaving the EU will hurt UK economy #BBCDebate https://t.co/Cv0irBi7QJ
"Almost half of our exports go to EU countries, supporting jobs across Britain. #BBCDebate #LabourInForBritain https://t.co/IgFNHRoQx9"
"Sadiq Khan nails it: ""The evidence is clear: we are stronger, safer &amp; better off in Europe"" #BBCDebate"
"For jobs, growth and workers’ rights, we’re IN for Britain. Share if you are too #BBCDebate https://t.co/CReTiQ6rUL"
Jo Cox would have been 42 tomorrow – join an event across the world to honour her life and legacy: https://t.co/pB3EwpJJ2o #MoreInCommon
Today @jeremycorbyn was live on Facebook to say why he's voting Remain. Watch again: https://t.co/GZpeYA1vPM #EUref https://t.co/B6odsYGkT6
"In just two days' time, we'll be heading to the ballot box to vote Remain. If you're with us, share this ↓ #EUref https://t.co/X3HoOUp0Ll"
Voting Remain on Thursday? RT this ↓ #VoteRemain #LabourInForBritain https://t.co/aSox7zd9zK
RT @FrancesOGrady: Two hours to go before we're live for #BBCDebate. Looking forward to putting the case why working people should vote #Re…
"Join one of the global events on Wednesday to honour Jo Cox, on what would have been her birthday: https://t.co/pB3EwpJJ2o #MoreInCommon"
"For 70 years of peace, Yvonne is voting Remain on Thursday. RT if you agree with her ↓ #EUref #VoteRemain https://t.co/HpFYmIODo8"
"To tackle climate change &amp; protect our plant, we must work together. That's why Louisa is voting Remain #VoteRemain https://t.co/FRRgTgpWiw"
"For her children and grandchildren's future, our supporter Doreen is voting Remain on Thursday. Agree? RT ↓ #EUref https://t.co/3ci8cWactw"
We asked our supporters why they're voting Remain on Thursday. We think Edward put it nicely ↓ #EUref #VoteRemain https://t.co/nICHmBCLlU
Plan your journey to the ballot box this Thursday with our polling station finder → https://t.co/8u0Vr5Uy9R #EUref https://t.co/D9i6FLyxIC
"RT @UKLabourIN: Alan Johnson: In the next 48 hours, it’s Labour members that will keep Britain in Europe. https://t.co/FE5MAgist5 https://t…"
RT @UKLabourIN: This afternoon the bus was in Durham with Angela Eagle &amp; Alistair Darling. #LabourInForBritain https://t.co/fMir6327KZ
"If you believe in the fairer and more just world that @jeremycorbyn does, vote Remain on Thursday. RT ↓ #EUref https://t.co/cOZaTV70Si"
Make sure you're ready to vote on Thursday - find your polling station now and RT so others do too: https://t.co/8u0Vr5CWLh #EURefReady
Watch @jeremycorbyn make his case for Remain LIVE: https://t.co/G5kNHgIkQE #EUref https://t.co/FmDwUJp0Cu
“A vote for Remain puts our economy first. Join me in voting Remain to protect jobs &amp; rights at work.” @jeremycorbyn https://t.co/ZAJsc3E0uB
"A Tory-led Brexit risks economic recovery and threatens a bonfire of employment rights, says @jeremycorbyn #EUref https://t.co/dwNLdRzHCo"
"Thursday's decision boils down to one question: what's best for jobs, workers' rights, future prosperity? #EUref https://t.co/COGfB6ubcc"
"Thursday's choice puts British jobs and future prosperity on the ballot paper, says @jeremycorbyn #EUref https://t.co/PqPz0aPfD5"
"3 million British jobs are linked to our trade with EU - jobs in companies big &amp; small, in vital industries like manufacturing #EUref"
We're LIVE now with @jeremycorbyn. Tune in: https://t.co/zOfJk3XaOY #euref https://t.co/cPqjZ7G85L
"Alan Johnson, @HackneyAbbott and @jeremycorbyn are LIVE now: https://t.co/zOfJk3XaOY #EUref https://t.co/gVUeD09isB"
"We're LIVE with Alan Johnson, @jeremycorbyn, @HackneyAbbott and @KateGreenSU now: https://t.co/G5kNHgIkQE #EUref #LabourInForBritain"
"Join @jeremycorbyn, @KateGreenSU &amp; Alan Johnson at 11am as they discuss #EUref live from @PHMMcr → https://t.co/G5kNHgZVIc"
"From 11am @jeremycorbyn will explain why voting Remain is vital for jobs, rights, the economy &amp; our NHS. Watch live: https://t.co/G5kNHgZVIc"
Not sure where your polling station is? Pop your postcode in and find out with our polling station finder → https://t.co/8u0Vr5CWLh #EUref
"If you're voting Remain in two days' time, share this ↓
#LabourInForBritain #EUref https://t.co/6W9yKMCoaG"
"Today at 11am @jeremycorbyn, @KateGreenSU &amp; Alan Johnson will outline why they're voting Remain. Watch live: https://t.co/G5kNHgZVIc #EUref"
"For jobs, workers' rights, lower prices and our NHS - we're voting Remain. If you are too, RT ↓ #LabourInForBritain https://t.co/pTfcdTLeYG"
"Get ready to vote on Thursday: find out where your polling station is now → https://t.co/8u0Vr5CWLh
#EUref"
"In just two days' time, we'll be heading to the ballot box to vote Remain. Share if you're with us ↓ #EUref https://t.co/4bM4LQ3Iup"
Voting Remain on Thursday? Make sure your friends and family know - share this and say you're IN for Britain #EUref https://t.co/RyuGL3Nlcj
"Vote Remain on Thursday for 3 million jobs, vital workers' rights, lower prices for everyone, and our NHS. RT ↓ https://t.co/DCIeSeHl2o"
"Whether you support #ENG or #WAL, the Premier League boss says our top flight football benefits from our EU membership #EUref"
The boss of the Premier League is clear: English football benefits from Britain’s membership of the EU #ENG #ENGSLO #EUref
"To make progressive reform, we must Remain in the European Union. RT if you agree with @jeremycorbyn #InOrOut #EUref https://t.co/M7ob9ULrQY"
