"Polls close at 8 p.m. in primary states tonight. At that point we may see race calls, if Trump's lead holds up. https://t.co/qOjKZaVDXX"
"Northeast Primaries: Live coverage from Md., Pa., Conn., R.I., and Del. https://t.co/EkU5dFziE7"
Secret Service: Man Fleeing Scene of Robbery Jumps White House Fence https://t.co/BfjuA1fQgb
"Northeast Primaries: Live coverage from Maryland, Pennsylvania, Connecticut, Rhode Island and Delaware https://t.co/GdYCSmXkKd"
RT @GlennHall: Trump University fraud suit to go to trial https://t.co/bZoK6MsBqg via @WSJlaw https://t.co/3G83KrEkoa
"Hillary Clinton has won 76 of big city/suburban counties, up 39 from 2008. What that means for Pennsylvania: https://t.co/DFmCHEpYOk"
Bernie Sanders mentions Elizabeth Warren as possible running mate  https://t.co/VmXhD2HZ6e
Donald Trump Welcomes Stars’ Departures for Canada https://t.co/NxDTozLpl0
"""Given the two evils, I'd probably vote for Hillary"" -- a Sanders voter in Maryland on Trump-Clinton match-up. https://t.co/GdYCSneVBL"
RT @laurameckler: The shop at 30th Street Station in Philly has pivoted to the general election. https://t.co/QD99YpFiSZ
"A Trump voter in Warwick, R.I.: ""I don't like the way things are going in this country."" https://t.co/GdYCSmXkKd. https://t.co/JcQ7LHBGqj"
FBI plans to keep Apple iPhone-hacking method secret https://t.co/X0Hq0QKCOU
"Jane Sanders says Bernie will release more tax returns when Hillary Clinton releases her speech transcripts 
https://t.co/hxLwoJaCnH"
RT @jenniferlevitz: Wonder who this guy is supporting? At polls in Providence https://t.co/sTu3yJ1ggZ
"Voter voices: ""There isn't enough money in the world to make me vote for Hillary,"" says one Sanders supporter https://t.co/tUolDbfMwy"
"Jane Sanders says Bernie will release more tax returns when Hillary Clinton releases her speech transcripts 
https://t.co/gaYRDasGkR"
RT @TimJHanrahan: Jane Sanders says Bernie will release tax returns when Hillary Clinton releases speech transcripts https://t.co/OR7SxTuc7y
RT @aaronzitner: We're in uncharted territory when it comes to the low regard voters have for Trump and Clinton. https://t.co/gqcvw4OZp9  @…
"RT @RichardRubinDC: Will we see more Bernie Sanders tax returns? Eh......
https://t.co/OG8CkEMkoc via @WSJ"
What's next for Sanders? Cruz? Who's favored tonight? WSJ's @ReidEpstein and @laurameckler take your questions live: https://t.co/7kh98PVUEs
WSJ's @ReidEpstein and @laurameckler take your questions on tonight's presidential results. LIVE NOW: https://t.co/AET9GhALob
"Bernie Sanders said it will be up to Hillary Clinton, not him, to rally his backers if she wins the Dem. nomination https://t.co/WdEblAxkf9"
Donald Trump’s Tone Was ‘Evolving.’ Will His Upcoming Speeches Be Presidential? https://t.co/gszWcef5DK
"Business executives' lament: “The center has collapsed. Sanders and Trump will go away, but their supporters won’t.” https://t.co/iMT1dkcxYk"
"RT @davidmwessel: Peter Hart: Independent voters hostile to Trump &amp; Clinton. Victor won't be most popular,but least detested  https://t.co/…"
Ted Cruz and John Kasich are pinning their fading hopes on Indiana’s Republican presidential primary next week  https://t.co/qaah7IrVO6
Bernie Sanders Mentions Elizabeth Warren as Possible Running Mate https://t.co/xqiNkZ9GTH
Bernie Sanders in no mood for party unification  https://t.co/WIWPomL0dk
WSJ's @dchinni looks at what to watch for as the election map fills in tonight. https://t.co/7R5voBHsi0 https://t.co/VBNT2csvEq
Clinton and Trump Hit Uncharted Depths With Independents https://t.co/iIRp5GaIQ7
Transgender law spurs more rallies in North Carolina     https://t.co/bevfak16gf
"RT @WSJThinkTank: ""For Ted Cruz and Bernie Sanders, April has become the cruelest month.""  https://t.co/UPr8n6kkJn by @danschnur https://t.…"
"RT @TimJHanrahan: Pollster Peter D. Hart on how Clinton and Trump are hitting unprecedented lows with independents
https://t.co/vwoMWW4RbL…"
"For Clinton and Trump, the contest looks like a race to Badwater Basin https://t.co/BgVweS7i97  by Peter D. Hart"
What to look for in Tuesday's East Coast primaries https://t.co/f61ziUcMXp
"RT @kristinapet: Today's primaries in MD, PA to test anti-establishment fervor among Dems:  https://t.co/6KNu2dDr8d via @WSJPolitics https:…"
"Where the poll averages stand in Pennsylvania, Maryland and Connecticut https://t.co/LwI9f4xMhO"
One big question that will become more clear after Tuesday: What is the state of the Republican establishment vote? https://t.co/t2Y2C2TnkS
Video: What will Tuesday's primaries reveal about the direction of the presidential races? @GeraldFSeib explains https://t.co/GcYmIt2dDL
How Tuesday’s East Coast Primaries Could Fuel Donald Trump’s Momentum https://t.co/SaRoIEGp1a
Ted Cruz and John Kasich pin their fading hopes on Indiana’s Republican presidential primary next week https://t.co/ZCkzZ6D8CB
RT @WSJThinkTank: Tuesday's #PrimaryDay contests and Donald Trump's momentum: https://t.co/UPr8n62JRP by @ddkochel and @jamespmanley https:…
"RT @TomBurtonWSJ: Does FDA ""flexibility"" mean  approving drug in 12 patients, w. historical controls? #Duchenne My @WSJ story
https://t.co/…"
"RT @Dchinni: Clinton has won 76 of big city/suburban counties, up 39 from 2008     https://t.co/xVoG1e30g8 via @WSJ"
Hospitals and some nurses’ groups push multistate licensing compacts in bid to spur remote health services https://t.co/JwDHG3HuJ9
"Congressional Primaries in Pa., Md. to Test Anti-Establishment Wave Among Democrats https://t.co/5suFDwdG26"
What to look for in Tuesday's East Coast primaries https://t.co/4NRhBtW7R7
"Congressional primaries in Pa., Md. to test anti-establishment wave among Democrats https://t.co/dyDgM4AgBj"
Bernie Sanders in No Mood for Party Unification https://t.co/9Zmst3aEZj
"Revisiting Obama's ""Red Line"": The costs and benefits of not striking Syria https://t.co/i2s8mIL8v6 by @MichaelSinghDC"
Obama urges European allies to step up fight against ISIS https://t.co/48q4st8JYH
President Xi Jinping’s most dangerous venture yet: remaking China’s military https://t.co/dgkTjUyTZl
"RT @hookjan: Looking past the Eastern Seaboard GOP primaries, Trump foes pin hopes on Indiana. w@reidepstein  https://t.co/RXBByz1CRB via @…"
Fed statement this week could offer clues toward June rate decision https://t.co/BE39CpA6tO
Colorado’s Jon Keyser Falls Short In Bid for Spot on Senate Ballot https://t.co/Acd6ZD67HV
Can’t make heads or tails of patent challenges? Neither can the chief justice     https://t.co/fIBfrJJi5U
New poll shows young voters overwhelmingly prefer Clinton over Trump https://t.co/UGeqUaY10a
"Presidential race: The latest national poll averages, plus Pennsylvania, Maryland and Connecticut https://t.co/rHRwxCpO7F"
Martin O'Malley backs Chris Van Hollen in tight Maryland Senate race https://t.co/tmcaIEnIVy
Why six swing-state GOP senators are in trouble - and how they can survive https://t.co/Y9laVZjl1z by @geraldfseib
Martin O’Malley Backs Chris Van Hollen in Tight Maryland Senate Race https://t.co/S0r4iXAtEG
"Bernie Sanders bashed Hillary Clinton, but he'd back her against GOP https://t.co/bPUyDtAm0L"
"With Term Waning, Barack Obama Aims to Stabilize Relations in Middle East https://t.co/zsypphaAaW"
"What are the ""28 pages"" everyone keeps talking about, and who wants them released? https://t.co/XgeCfA281S"
"RT @TimJHanrahan: Donald Trump trashes Cruz-Kasich deal, rolls out fresh insults about losses, table manners https://t.co/egSF23y7sJ"
"Donald Trump trashes Cruz-Kasich deal as ""collusion"" and rolls out fresh insults https://t.co/F5xA3bVY2f"
"Donald Trump Trashes Cruz-Kasich Deal, Rolls Out Fresh Insults https://t.co/dCtTFZdiYK"
Bernie Sanders signals he is ready to scale down attacks on rival Hillary Clinton https://t.co/sYAbovcV33
"RT @bethreinhard: MIns after Trump says in RI he'd love Bobby Knight's support, campaign announces the famed coach will join him at Indiana…"
Ted Cruz and John Kasich are teaming up to stop Donald Trump     https://t.co/fmRO5uTWr4
The Outlook: Long-term costs of cutting emissions grow hazy       https://t.co/UknzwrRijN
Chris Van Hollen vs. Donna Edwards -- where things stand #mdsen https://t.co/V6ZKyhnUJw
Climate Activist Tom Steyer to Launch Voter Outreach Effort https://t.co/ybotur0VBY
Obamacare? Zika? Here are the health stories Americans actually follow https://t.co/gJX6nY0BHE  by @drewaltman  @WSJThinkTank
Cruz-Kasich alliance is the latest stunner in the GOP race     https://t.co/VOzfCgaBnM by @GeraldFSeib
New: Christie campaign strategist Ken McKay to advise Donald Trump https://t.co/nl6Yb2oAiX by @heatherhaddon
"Where the poll averages stand in Pennsylvania, Maryland, Connecticut presidential primaries https://t.co/BtU5URLKDp"
"Following Obama's trip, here are three takeaways on the newly assertive Saudi Arabia https://t.co/eTbhUUPs8r by @katulis"
"RT @jenniferlevitz: Maryland is projected to become the country’s sixth majority-minority state in 2020. 
https://t.co/JBeIcSY8FW via @WSJ…"
Catch up on the presidential election: All 2016 primary and caucus results so far https://t.co/wQudspqiWv
Young Voters Overwhelmingly Prefer Clinton Over Trump — Poll https://t.co/T245kk6I9I
New: Poll shows young voters overwhelmingly prefer Clinton over Trump https://t.co/pWrqANPP9g by @HookJan
A hard-fought Senate race in Maryland will test the political clout of the state's growing minority population https://t.co/HGJ5erlQjR
"RT @scottmcalvert: Md., on pace to become the 6th majority-minority state in 2020, has never elected a black senator. Maybe this year. http…"
Ted Cruz backers secure more delegate slots than Donald Trump in Maine and Utah    https://t.co/5rm82tQyMN
RT @Dchinni: The oddest thing about the Cruz-Kasich alliance is the assumption that it can corral &amp; control voters. It goes against all of…
"Obama plans to send as many as 250 more military personnel to Syria to help local forces, extend gains against ISIS https://t.co/N0yx1QkRda"
Maryland is projected to become the country’s sixth majority-minority state in 2020 https://t.co/2d8l6PJlDl
"Where Pa. voters could make or break campaigns, and more in CJ Daybreak https://t.co/flRzeEvku1"
Maryland Senate Race Tests Clout of Minority Voters https://t.co/kqH9tVlzkI
"Who benefits the most from Bernie Sanders's free college plan? Upper income households, according to new analysis https://t.co/9aVC8DikuP"
CEOs at big American companies are increasingly frustrated by the populist tone of the presidential campaign https://t.co/5TzSkRMc12
Obama says North Korea must show it is serious about giving up its nuclear-weapons program https://t.co/Q9OYDKfaDr
"Donald Trump and Hillary Clinton have big leads in Pennsylvania, WSJ/NBC/Marist poll shows        https://t.co/4dtuTjqpWx"
The U.S. plans to send up to 250 additional military personnel to Syria to help local forces fighting Islamic State https://t.co/morZ1q00F3
Ted Cruz backers secure more delegate slots than Donald Trump in Maine and Utah    https://t.co/s5Td692eun
"Fight brews in House over use of ""illegal alien’ by Library of Congress https://t.co/iaQF6y4qVu"
RT @Kate_OKeeffe: The @SenTedCruz campaign once again trounces @realDonaldTrump in the delegate game https://t.co/krpCtFypqS
President Obama expresses skepticism over North Korean offer https://t.co/bluJoyj9PO
"Bernie Sanders bashed Hillary, but he would back her against GOP https://t.co/c1D2t2Q9V2"
RT @TimJHanrahan: WSJ/NBC/Marist poll: Donald Trump and Hillary Clinton build big leads in Pennsylvania https://t.co/wpXljU73jG https://t.c…
The rise and deadly fall of ISIS’s oil tycoon https://t.co/rkdHPz9DUJ
Obama expresses skepticism over North Korean offer    https://t.co/xSikOXEBoV
"New: U.S. to expand presence in Syria, send additional 250 military personnel https://t.co/DXh5FL5Peu
by @adamentous @glubold"
The rise and deadly fall of Islamic State’s oil tycoon https://t.co/Na2lZq0PsX
WSJ/NBC/Marist poll: Donald Trump and Hillary Clinton build big leads in Pennsylvania https://t.co/OnqZtzAfHl https://t.co/Xync3T6ctT
"RT @bethreinhard: Donald Trump, campaigning in MD, says ""lyin' Ted Cruz"" will be one of his best friends in a few weeks."
"Bernie Sanders bashed Hillary Clinton, but he'd back her against GOP https://t.co/gm6k6hgsJf"
"Bernie Sanders Bashed Hillary, But He’d Back Her Against GOP https://t.co/gXynjDU8Yd"
Former Senator Presses for Release of 9/11 Papers That Would Impugn Saudis https://t.co/UpeU1Lncje
New Clinton ad warns voters on Trump's 'extreme makeover' https://t.co/AJDDsKXXoS via @WSJ
Could Charles Koch rally behind Hillary Clinton? https://t.co/FBQCMVVpWs
"RT @JamesVGrimaldi: Donald Trump, Hillary Clinton have double-digit leads in Pa. primary, poll shows 
https://t.co/q8EdZI6rPC"
RT @bobdavis187: A deep dive into @BernieSanders plan for free tuition. Do the numbers add up? https://t.co/B1BVkN3V5J via @WSJ
"Donald Trump, Hillary Clinton look set to build on lead in Pennsylvania primary, poll shows        https://t.co/oNbdO3oPaG"
"Fight brews in House over use of term ""illegal alien"" by Library of Congress https://t.co/2xMJGvcNfS by @kristinapet"
"Fight brews in House over use of term ""illegal alien"" by Library of Congress https://t.co/913g2mTJN7 by @kristinapet"
"Billionaire Harold Hamm endorses Donald Trump, calling him ""best choice"" https://t.co/09drpFFWH9 by @AmyAHarder @RebeccaBallhaus"
Former Pennsylvania Governor Renews Support for Hillary Clinton https://t.co/LRVYrtHtQt
Why six swing-state GOP senators are in trouble - and how they can survive https://t.co/7YnApRv1gw by @geraldfseib
"Your currency questions answered: Harriet Tubman, Alexander Hamilton and the currency redesign https://t.co/lXA1HayK33"
Hillary Clinton Ad Warns Voters on Donald Trump’s ‘Extreme Makeover’ https://t.co/Gb6xNvjbyX
"In two states holding primaries next week, Emily's List spending has become a flashpoint dividing Democrats https://t.co/VuQ44MvgjG"
Some Democrats worry the harsh tone of the Bernie Sanders's campaign could make it tough to unify the party https://t.co/IZGcv10sTH
How Donald Trump won New York landslide but lost Manhattan https://t.co/zmO5PgW9iz
Virginia's governor restores voting rights to thousands of felons https://t.co/mQK57fYRex
Virginia governor restores voting rights to thousands of felons https://t.co/NlZbz8IfMX
"What are the ""28 pages"" everyone keeps talking about, and who wants them released? https://t.co/fHQTfksP33"
Congress isn’t going to overhaul the immigration system soon. But that doesn’t mean they can’t fight about it https://t.co/roL4EmGDw8
"After short break, Bernie Sanders goes back on attack against Hillary Clinton in Pennsylvania https://t.co/dXivxRSNDo"
Republicans beat back proposal to make it harder for elders to anoint a ‘white knight’ presidential candidate https://t.co/4CYC0MFhsn
Hillary Clinton plays up gun-control stance ahead of Connecticut’s Democratic primary https://t.co/SOkOMW4bZh
Hillary Clinton is turning to themes likely to dominate a potential-general election campaign against Donald Trump. https://t.co/nNFdgeqouR
"London's mayor cites ""ancestral dislike"" as potential reason for Obama's stance on Churchill, 'Brexit' https://t.co/Shtrsp6oDJ"
"Who benefits the most from Bernie Sanders's free college plan? Upper income households, according to new analysis https://t.co/deP4kgbhoK"
"Obama avoids saying ""genocide"" in commemorating Armenian deaths https://t.co/8Uppek7cFg"
"Prince George got to stay up late to greet the Obamas 
https://t.co/eHM8G9qZ37 https://t.co/10zTwhOo8E"
"RT @ColleenMNelson: On the 400th anniversary of The Bard's death, Obama is visiting Shakespeare's Globe in London. https://t.co/Td4FuTqkwG"
Red Line revisited: The costs and benefits of not striking Syria https://t.co/5A36js9dBl  by @MichaelSinghDC
Why six swing-state GOP senators are in trouble - and how they can survive https://t.co/Ed9Y1ZhAoP
"Q&amp;A: Explaining the ""28 pages"" and the 9/11 hijackers https://t.co/GK1TzYRHYY"
"In two states holding primaries next week, Emily's List spending has become a flashpoint dividing Democrats https://t.co/nyqKgXTsF7"
"What are the ""28 pages"" everyone keeps talking about, and who wants them released? https://t.co/HrfhywGzOC"
Young Prince George Stays Up Late to Greet Obamas https://t.co/CTpHT2hw17
"Prince George stays up late to greet the Obamas 
https://t.co/D77eApRWhR https://t.co/tna2AODCCC"
RT @TimJHanrahan: WSJ's @ColleenMNelson has this report from London on the Obamas' meetings with UK royals https://t.co/njnmADLOXH https://…
"Bathroom brawl: Donald Trump, Ted Cruz clash on transgender rights https://t.co/gLhl8SrjEV"
"Revisiting Obama's ""Red Line"": The costs and benefits of not striking Syria https://t.co/PBYRz0gzOb by @MichaelSinghDC"
RT @louiseradnofsky: Fight brewing in House over the immigration words used by the Library of Congress https://t.co/xTEPQ9HF5R via @kristin…
"Fight brews in House over use of term ""illegal alien"" by Library of Congress https://t.co/5Hu2BXZWSo by @kristinapet"
President Barack Obama meeting  Prince George at Kensington Palace. https://t.co/i2C2YwJeTR
"Following Obama's trip, here are three takeaways on the newly assertive Saudi Arabia  https://t.co/wyEz3QsQGo by @katulis"
"RT @ColleenMNelson: For those who are wondering, the Duchess of Cambridge is wearing L. K. Bennett tonight. https://t.co/yhK3JVGoSS"
"London's mayor cites ""ancestral dislike"" as potential reason for Obama's stance on Churchill, 'Brexit' https://t.co/B8UgwdyJgv"
Three Lessons on the Newly Assertive Saudi Arabia https://t.co/e8cr3T3VMY
"RT @ColleenMNelson: Prince William, wife Catherine and Prince Harry wait outside the palace to greet their dinner guests, the Obamas. https…"
"RT @TimJHanrahan: Fight brews in House over use of term ""illegal alien"" by Library of Congress https://t.co/tjBjPIbfCg by @kristinapet"
"More than 200,000 convicted felons now eligible to vote, after executive order by Virginia's Gov. McAuliffe https://t.co/ZSD4WyEfcj"
"RT @WSJThinkTank: Revisiting Obama's ""Red Line"": The costs and benefits of not striking Syria https://t.co/OOfkp3S2M8 by @MichaelSinghDC"
Suicides in the U.S. climb after years of declines https://t.co/bcAN25l363
Fight Brews in House Over Terms Used by Library of Congress for Immigration https://t.co/CRLsMGDTT4
Why six swing-state GOP senators are in trouble - and how they can survive https://t.co/N9P6G5O0Vr by @geraldfseib
Supporters of U.K. exit from the EU accuse President Obama of meddling https://t.co/XYLr81NeWx
Virginia's governor restores voting rights to thousands of felons https://t.co/jaEZ9IAQAK
"Billionaire Harold Hamm Endorses Donald Trump, Calling Him ‘Best Choice’ https://t.co/BvjHmL4s7W"
"Boris Johnson floats  ""ancestral dislike"" for Obama's stance on Churchill, 'Brexit' https://t.co/cqY3rdSAHA"
Republicans begin tangling over convention rules https://t.co/R2SRH8bIYr
"WSJ: Billionaire Harold Hamm endorses Donald Trump, calling him ""best choice"" https://t.co/BwKSgCgzeg by @AmyAHarder @RebeccaBallhaus"
RT @kristinapet: The nail-biting Maryland Senate Dem primary opens a rift over Emily's List: https://t.co/tDPlWlt8oM @WSJPolitics https://t…
Would upper income households benefit the most from Bernie Sanders's college-tuition plan? https://t.co/7FW32G6wNG
Red Line Revisited: The Costs and Benefits of Not Striking Syria https://t.co/eBczX7kmkv
Hillary Clinton plays up gun-control ahead of Connecticut’s Democratic primary https://t.co/3fx5vAluyf
"After short break, Bernie Sanders goes back on attack against Hillary Clinton in Pennsylvania https://t.co/w1hZ6A3B6F"
Hillary Clinton plays up gun-control issue in Connecticut’s Democratic primary https://t.co/0i09ANfXCV
Why six swing-state GOP senators are in trouble - and how they can survive https://t.co/vNrh4UsnXi
Updated: Sanders camp disputes a study that raised questions about his free college-tuition plan https://t.co/ERTTYhTnFl
Why Six Swing-State GOP Senators Are in Trouble – And How They Can Survive https://t.co/F7HBPCxEUt
"Trump says he is shifting campaign approach; ""I’m not going to blow it."" https://t.co/EGo87oVRPK"
"What are the ""28 pages"" everyone keeps talking about, and who wants them released? https://t.co/MBS2G3HNCh"
Obama says U.S. and Gulf Arab allies share ‘broad common vision’       https://t.co/bj3VS7KRmC
Bernie Sanders faces a daunting task: winning more black votes https://t.co/BQwU2vEjD6
No Labels Sees Voters Ready for Bold Ideas https://t.co/OD5iuLQu7T
Comey says FBI paid more than $1 million to hack San Bernardino iPhone https://t.co/mrqZeBGi9p
"Obama to encourage better relations between Saudi Arabia and Iran, but America is seen as part of the problem https://t.co/xhXFJRc2JR"
"Your currency questions answered: Harriet Tubman, Alexander Hamilton and the currency redesign https://t.co/XCIziKWHXV"
Some Democrats worry the harsh tone of the Bernie Sanders's campaign could make it tough to unify the party https://t.co/szhKCVfzHC
"Lew originally planned to put Susan B. Anthony on the $10 bill and scrap the penny, according to a March 2015 memo. https://t.co/uFQNBFGJ7E"
How Donald Trump won New York landslide but lost Manhattan https://t.co/D1AEi0Z3Im
Presidential front-runners get breathing room after New York vote     https://t.co/0MPvy2ZQcz
"Who benefits the most from Bernie Sanders's free college plan? Upper income households, according to new analysis https://t.co/o0mGU39gBd"
Comey: FBI paid more than $1 million to hack San Bernardino iPhone https://t.co/96LFtMqBf1
Obama says U.S. and Gulf Arab allies share ‘broad common vision’       https://t.co/d5pZVw2w7i
Bernie Sanders Renews Attacks on Hillary Clinton in Pennsylvania https://t.co/TJPCkXX5Zm
"What are the ""28 pages"" everyone keeps talking about, and who wants them released? https://t.co/ypJGAaMmxB"
"Q&amp;A: Explaining the ""28 pages"" and the 9/11 hijackers https://t.co/9GtzU9DuOr"
How Donald Trump won New York in a landslide but lost Manhattan https://t.co/HU9PMe0tRA by @DChinni
"RT @laurameckler: New tone? Um, no. @BernieSanders renews attacks on Clinton in PA return to trail via @PeterNicholas3  https://t.co/v2bfhD…"
"RT @PeterWSJ: After NY loss @berniesanders renews attacks on @hillaryclinton. Not backing down, despite some calls to soften tone https://t…"
"What are the 28 secret pages, and what could they tell us about the 9/11 attacks? https://t.co/xMdwd2fX2K"
"Anti-Trump Forces See Plenty of Roadblocks to 1,237 Delegates https://t.co/pfD5KynQIm"
Obama to wade into Brexit debate on London visit with call for European cohesion.     https://t.co/Dc7ndWzDlX
Proposed Wall Street pay rules are a win for big hedge funds and mutual funds  https://t.co/eVarin8N0T
Not just Rubio: Florida's congressional delegation is poised for the biggest turnover in decades  https://t.co/6I5cQzQ5Qr by @acampoflores
"Benefits of Sanders’s College Plan Bigger for Wealthy, Analysis Finds https://t.co/MMh4HzQTS9"
RT @MaryLuWSJ: Proposed Wall Street pay rules are a win for big hedge funds &amp; mutual funds  https://t.co/YOp3JSl2Vd
RT @MaryLuWSJ: Education expert at Brookings finds that Sanders's free college plan tilts toward the wealthy. via @JMitchellWSJ: https://t.…
President Obama issues statement on Prince's death: https://t.co/C7MXmxZpCs
Treasury Secretary Lew planned to put Susan B. Anthony on $10 bill and scrap the penny before shifting course https://t.co/pWKv0K7pw6
U.S. regulators have moved quickly to authorize expanded uses of unmanned aircraft https://t.co/UXn4xv0YzC
"Bathroom Brawl: Donald Trump, Ted Cruz Clash on Transgender Rights https://t.co/TrxIh5m6iE"
Donald Trump's goat herd helps him save tens of thousands in property taxes https://t.co/0lyj7PH922
Bernie Sanders faces a daunting task: winning more black votes https://t.co/opd86TTwFi
Q&amp;A: Treasury secretary Jacob Lew explains his currency redesign plan https://t.co/L47jRuUoBp
Obama says Syria cease-fire facing collapse https://t.co/W2PPtIik1e by @ColleenMNelson
RT @WSJCentralBanks: Questions about the redesign of the $20? Ask @WSJ's Jon Hilsenrath and Nick Timiraos now https://t.co/INtb3brlHH https…
U.S. seeks better deterrence in Europe against Russian aircraft https://t.co/SgKNY252tO
Questions about the redesign of the $20 bill? WSJ economy reporters Jon Hilsenrath and Nick Timiraos answer now. https://t.co/GA8X3RcBrt
Questions about U.S. currency and the redesign of the $20 bill? Jon Hilsenrath and @NickTimiraos are live: https://t.co/dYDXGtQkeu
"Donald Trump says Andrew Jackson has a ""great history,"" says Harriet Tubman should go on $2 bill instead https://t.co/eTeBeK46wq"
Solar-energy company SunEdison files for Chapter 11 bankruptcy protection https://t.co/kHAfZdePhx
RT @hookjan: Paul Manafort goes to Hollywood. RNC style https://t.co/XH91IEPKBJ via @WSJ
Fundraising Reports Show More Puzzling Aspects of Campaign 2016 https://t.co/822RuM0XpK
Volkswagen reaches deal with U.S. authorities over diesel emissions scandal https://t.co/YitbjyYUtU
Donald Trump has found a way to cut both his grass and his tax bill: Goats. https://t.co/GLOaaeswpI  by @RichardRubinDC
Trump's new direction is a shift from campaign manager Corey Lewandowski’s mantra “Let Trump be Trump.” https://t.co/KEewO6yHoJ
"WSJ: Trump is shifting campaign approach; ‘I’m not going to blow it,’ he says    https://t.co/zr1y9VBkrT"
"RT @Rubinations: Donald Trump says Andrew Jackson has a ""great history,"" says Harriet Tubman should go on $2 bill https://t.co/Vz8dW7AX0p"
"Donald Trump: Keep Andrew Jackson on the $20, Put Harriet Tubman on the $2 https://t.co/FBrPOHIKtc"
