"Eleven states, led by Texas, are suing the Obama administration over a its new transgender bathroom policy https://t.co/8AjvrEPkUd"
"As the GOP's anti-Trump chorus dwindles, Mitt Romney is one of the few who continues to make the case publicly. https://t.co/AiFCaZRCWf"
"""It was allowed,"" Hillary Clinton defends her use of a private server for email after critical watchdog report: https://t.co/O3t7EPDrkH"
Third-party candidates are seeing a chance to play a significant role in the fall presidential campaign https://t.co/Wf4OQuf2do
"Twitter's #manenough4hillary meme was debunked as a hoax, not a real campaign ad  https://t.co/iF8MkmpvVj"
"Failed 2016 presidential candidates still owe more than $5.4 million, FEC records show. https://t.co/NS8qWbE28w by @RebeccaBallhaus"
"Four years after his presidential campaign, Newt Gingrich still owes $4.6 million. What the 2016 candidates owe: https://t.co/XnWwg2Akf1"
"Reality may differ for different Facebook users. Try this interactive with two feeds, one liberal, one conservative. https://t.co/n535UCRREn"
"Donald Trump raised $6 million in first joint fundraiser with RNC, held in Los Angeles https://t.co/WQ9juaNpXw"
"At rally, Trump criticizes federal judge in Trump U case -- ""Negative, negative, negative"" https://t.co/jtthOxalpx"
"RT @TimJHanrahan: For 12 minutes, Trump blasts federal judge overseeing civil litigation on Trump U. “He’s a hater."" https://t.co/jGWB9YlCTB"
"Here's the full transcript of President Obama's remarks at the Hiroshima peace memorial, plus video https://t.co/UmOX9ZI05G"
"“This is going to change the way we fight."" A first look at America's supergun. https://t.co/01vMAW0O8R"
"RT @reidepstein: In Fresno today, Trump said Hillary Clinton isn't ""presidential"" because he dislikes the sound of her voice https://t.co/O…"
Trump speaks out against the federal judge overseeing the civil litigation on Trump University. https://t.co/0f0iP7XJ0M
"RT @AndersonMH: 'Negative, negative, negative' @realDonaldTrump Attacks Federal Judge in Trump U Case https://t.co/7sclHii9sU"
"As the GOP's anti-Trump chorus dwindles, Mitt Romney is one of the few who continues to make the case publicly. https://t.co/1k2vYWCzLC"
Trump Attacks Federal Judge in Trump U Case https://t.co/RXt2FulnSi
Donald Trump raised $6 million in his first joint fundraiser with RNC https://t.co/WKZ9P65L2h
"Clinton's main lines of attacks against Trump:
-He's risky.
-He's out for himself
-He's a divider
More:
https://t.co/Gfpcxhx1Ox"
"Mitt Romney knows many are critical of his attacks on his successor, but ""that’s how I can sleep at night,” he says. https://t.co/G3SROP9Zz3"
Donald Trump raised $6 million in first joint fundraiser with RNC https://t.co/oLYeCLmAo6
Sanders says he still hopes that Trump will change his mind and agree to debate him https://t.co/jPuQPj1gbm
Sanders says he hopes that Trump will change his mind and agree to debate him https://t.co/jPuQPj1gbm
RT @MaryLuWSJ: Here's the full transcript of Obama's remarks at the Hiroshima peace memorial. + video https://t.co/uLB3OSXBtD https://t.co/…
RT @rebeccaballhaus: NEW: Trump raised $6M for his joint fundraising committee w/RNC at his first official funder in LA https://t.co/bLqpyj…
Donald Trump Says He Won’t Debate Bernie Sanders https://t.co/2rZYZNfRKc
Transcript and Video: Obama’s remarks at the Hiroshima peace memorial https://t.co/JjiBD4Wzf4
RT @hookjan: The Donald nixes the Great Debate with Bernie.  https://t.co/rxxOmZEoMC via @WSJ
Donald Trump says he won't debate Bernie Sanders https://t.co/AHmdiD7wV3 by @HookJan
Donald Trump: Clinton Not ‘Presidential’ Because He Doesn’t Like Her Voice https://t.co/36WvbDCrnk
Donald Trump nixes idea of debating Bernie Sanders. Statement: https://t.co/Ythd3c2TbL
Check out the 5 ways Hillary Clinton is attacking Donald Trump -- story + video https://t.co/JVj9bR0o7u
Behind Mitt Romney’s increasingly lonely challenge to Donald Trump https://t.co/xKQOL2BM7k
"RT @reidepstein: Trump in Fresno: “I am going to make a heavy, heavy play for California. Plus I have property here.”"
"Meet Harold Hamm, the colorful and politically-engaged oil mogul behind Donald Trump's energy speech. https://t.co/7aJlmiFEO1"
"RT @WSJThinkTank: Students prioritize free speech over 'safe spaces,' survey finds. @JeffHorwitt explains: https://t.co/xyuAIkgLm0 https://…"
Transcript and Video: Obama’s Remarks at Hiroshima Peace Memorial https://t.co/z4p85D3USr
An outside group allied with Mitch McConnell is prepared to support Marco Rubio - if he runs for re-election. https://t.co/K8QBMKnXOC
Trump said he sees 15 states (or is it 15 *new* states?) in play for the election https://t.co/89EwvW9KAi
President Obama made a historic visit to Hiroshima on Friday and talked with survivors of the atomic attack. Video: https://t.co/AskAXXVF8H
It turns out that the #ManEnough4Hillary Twitter meme was a hoax https://t.co/VMzelNINuN
A guide to Hillary Clinton's main lines of attack against Donald Trump:  https://t.co/vTw9Rrc0ue by @laurameckler
Hillary Clinton has honed her main lines of attack against Donald Trump. Here they are: https://t.co/CpcCOpnoPj
An Insight Into Divisions Over Administration Authority to Pay Obamacare Subsidies https://t.co/JejagVJEXj
"RT @reidepstein: In 2012, the Libertarian convention drew ~20 reporters. This weekend, it has 250, including our @ByronTau https://t.co/vq6…"
A first look at America's supergun that officials say can blow holes in enemy ships and level terrorist camps. https://t.co/TtfnVdnOuE
RT @davidmwessel: Mitt Romney talks about his increasingly lonely challenge to Donald Trump https://t.co/oXabpu1y6N via @WSJ
Libertarian Convention Sees Unprecedented Interest from News Media https://t.co/TJvNEkzi9J
Obama: Memory of Hiroshima bombing ‘must never fade’ https://t.co/qUY8Ubu1HS
RT @shelbyholliday: Campaign Fight Club is back! Democrats Take Aim at DNC Chair Debbie Wasserman Schultz https://t.co/nrdU0LSqvO
RT @monicalangley: Tortuous path of '12 GOP nominee @MittRomney's lonely war against successor @realDonaldTrump https://t.co/N2KSh9FzSy htt…
"“The president’s hand was very warm. It’s like a dream come true. I suffered so much.."" https://t.co/dLhQHzwBym"
"In his visit to Hiroshima, President Obama said the memory of the bombing ""must never fade""  https://t.co/Ve6mtxdrja
https://t.co/Sb4eQnL5sX"
"Capital Journal Daybreak: Today on the Campaign Trail, More https://t.co/GyKW46hrn9"
"In Congress, the buzz is turning to speculation over vice presidents https://t.co/4DQ0Mbpjrq by @KristinaPet https://t.co/BfkfCBjsdG"
"RT @TimJHanrahan: Romney tells @wsj: “Friends warned me, ‘Don’t speak out, stay out of the fray’ "" https://t.co/Zc5u42pol5 by @monicalangley"
"Mitt Romney: “I wanted my grandkids to see that I simply couldn’t ignore what Mr. Trump was saying and doing"" https://t.co/VT4l1hB08K"
U.S. first-quarter GDP revised higher; corporate profits rose https://t.co/ZrNGjajIQ6
Hillary Clinton talks unity in California as poll shows tight race https://t.co/KZn85ktkth
RT @GeraldFSeib: The problem for Trump and Clinton isn't just high negatives; it's negatives among groups that should back them.  https://t…
"RT @bethreinhard: Trump's version of Hispanic outreach: ""National...Hispanic...Outreach...three great words!"" https://t.co/H7TMJKpblv"
RT @reidepstein: Trump said yesterday that he doesn't need to hire battleground state staffers because the RNC is on it https://t.co/94UGLd…
"On Thursday, Donald Trump was challenged on his 'Pocahontas' nickname for Elizabeth Warren https://t.co/4wpnlsNBkx"
RT @ByronTau: Growing voter dissatisfaction has Libertarian and Green Party presidential candidates hoping for a big year. https://t.co/vfL…
RT @carolelee: Obama hugs atomic bomb survivor Shigeaki Mori after his remarks in Hiroshima https://t.co/J0Q7fQf3ZK
Interactive: Choose the qualities Donald Trump may look for in a vice president to see who the running mate could be https://t.co/QIBcj0nwOZ
A Guide to Hillary Clinton’s Full-Throated Attack of Donald Trump https://t.co/c3HCuk1Yl6
"Voters see Donald Trump as best able to change Washington and improve economy, poll shows https://t.co/qLfllLqn4Q"
"Bad vibes for Donald Trump, Hillary Clinton extend to core groups https://t.co/2yj3lO2oqF"
"House Speaker Paul Ryan is still not endorsing Donald Trump, and charting his own course as a party leader instead. https://t.co/AUQXE8c6xh"
Donald Trump sees 15 states (or is it 15 new states?) in play for election https://t.co/Nqwhx4W0ey
Donald Trump used a speech in North Dakota to take a victory lap after clinching the GOP delegate race: https://t.co/AvgicXv6Nt
House's Puerto Rico bill takes aim at the minimum wage and new federal overtime-pay rules https://t.co/a42c5NEFKz
Video: WSJ's @GeraldFSeib offers two reasons predictions about VP picks are likely wrong right now https://t.co/yeWSrunuPs
"Donald Trump's attack on Susana Martinez undermines Trump and GOP unity, says @DougHeye https://t.co/XB8K21znAS"
"Donald Trump's attack on Susana Martinez undermines Trump and GOP unity, says @DougHeye https://t.co/Vd3ieuFZlA"
"After a week, Hillary Clinton officially declared the winner of the Kentucky primary https://t.co/RZS4RR1JPi"
Antibias rules applied to transgender people pose tricky question for gay rights https://t.co/Ha7X8FRmZU
Trump Sees 15 States (or Is It 15 New States?) in Play for Election https://t.co/zKyur3TfiI
Five revelations from the watchdog report on Hillary Clinton's email use: https://t.co/XprHZD9e3v
Five revelations from the State Department's watchdog report on Hillary Clinton's email use: https://t.co/d8kWLSffiG
Donald Trump's national political director Rick Wiley leaves campaign just six weeks after joining the campaign. https://t.co/IHkNeqiWiI
"House Speaker Ryan is still not endorsing Trump, instead sticking with his strategy of charting his own course. https://t.co/ib0rkattWp"
"President Obama calls for Democratic party unity, urges candidates to ""stick to the issues"" https://t.co/jmG96PGCHe"
Donald Trump is challenged on his 'Pocahontas' nickname for Elizabeth Warren https://t.co/tJ7yEllqj2
RT @TimJHanrahan: Twitter's #manenough4hillary meme debunked as hoax https://t.co/W0roqTpuI8
Twitter’s #manenough4hillary Meme Debunked as Hoax https://t.co/9A91cmdQwy
"Voters see Donald Trump as best able to change Washington and improve economy, poll shows https://t.co/dhlJPJxXRY"
Eleven states sue Obama administration over transgender bathroom policy https://t.co/GjE8IkLzmU
"RT @rebeccaballhaus: Four years after ending his campaign, Newt Gingrich still owes $4.6M. How long will it take Walker, Christie et al? ht…"
"RT @ColleenMNelson: .@HillaryClinton weighs in on the prospect of a Sanders-Trump debate on MSNBC: ""Oh, I don't think it's going to happen."""
Video: Controversy over Hillary Clinton's email and Donald Trump's comments on Hispanics will continue to dog them https://t.co/ZqbwahKpbv
"RT @WSJThinkTank: Whether or not Donald Trump and Bernie Sanders debate, Democrats stand to lose https://t.co/GqYT8Y7lot @JamesPManley http…"
"Whether or Not Donald Trump and Bernie Sanders Debate, Democrats Stand to Lose https://t.co/f6CFVfmXVi"
"Hispanic support is eluding Donald Trump, and his recent attempts are getting mixed results. https://t.co/J2uYIBbupD"
Donald Trump says he would ‘love’ to debate Bernie Sanders https://t.co/TJ2S3MQ5VS
Hillary Clinton Urges Bernie Sanders Supporters to Unite Behind Her https://t.co/vDaDE02jSE
.@DanSchnur on the all-Democrat Senate race likely in California https://t.co/wCWzQ8fd90
"Hillary Clinton won’t debate Bernie Sanders anymore, but Donald Trump appears willing. https://t.co/FESdOsHf7T"
"RT @WSJThinkTank: ""I love watching Hillary and Bernie go at it,"" Donald Trump says in press conference. Live: https://t.co/LtJ1YDrUF4 https…"
Trump v. Sanders Debate? Don’t Start Popping the Popcorn Just Yet https://t.co/tnMDYedTB5
"RT @shelbyholliday: Trump was asked if he pays ""some"" federal taxes. His response- I do."
"RT @ByronTau: Trump calls the State IG report ""devastating"" and ""very very harsh"" to Hillary Clinton."
"RT @AmyAHarder: Donald Trump calls oil magnate Harold Hamm, who was Romney's energy adviser in 2012 race, ""king of energy"" and ""my friend f…"
"RT @AmyAHarder: Donald Trump calls Harold Hamm, CEO &amp; founder of Continental Resources, the ""king of energy"" and ""my friend for a long time…"
Watch: Donald Trump's press conference in North Dakota https://t.co/MnLBJ6h9Pa
RT @TimJHanrahan: Congress wants to repeal a law that criminalizes the unauthorized use of Smokey the Bear. https://t.co/ucdMiCNoab https:/…
RT @gonzowsj: New push in Congress to reverse 'overcriminalization' in criminal code https://t.co/PTAJaq9mJc
New push in Congress to reverse 'overcriminalization' in criminal code https://t.co/rniBfBFrFy
New Push in Congress to Reverse ‘Overcriminalization’ in Criminal Code https://t.co/lR5Oc1M8XS
Interactive: Choose the qualities Donald Trump may look for in a vice president to see who the running mate could be https://t.co/76fHqgWUuL
Track the delegate race in #Election2016 -- and see where the delegates are coming from: https://t.co/m1ksZo73GD
Donald Trump says he is open to a televised debate with Bernie Sanders https://t.co/LAcK5DaRz3 https://t.co/p5HitwRbCG
A Trump v. Sanders debate? Don't start popping the popcorn just yet https://t.co/R2di6IM2uQ
"Rick Wiley, Donald Trump's national political director, leaves campaign https://t.co/p51bys9n43"
Where does Donald Trump stand on energy policy? We may find out today https://t.co/2qwxqzxZhl
Review five new things we learned from the report on Clinton's email. https://t.co/tFNBhBxtMD by @ByronTau
"Donald Trump hits delegate count needed to clinch GOP nod, AP calculates https://t.co/1FqqG1HQrJ"
"Donald Trump hits delegate count needed to clinch GOP nod, AP calculates https://t.co/zzQrcHdISw"
How Donald Trump happened: A look at who the supporters are behind Donald Trump: https://t.co/d225sZ53zH
"Obama on Clinton and Sanders: “During primaries, people get a little grumpy with each other"" https://t.co/uyMdfC35jJ"
"RT @WSJThinkTank: Donald Trump has 1,238 delegates, enough for the GOP nomination. See where he won them: https://t.co/9NGD8Eu8Bm https://t…"
"RT @hookjan: Susana Martinez spox on Trump:""The governor will not be bullied"" @bethreinhard reports on his relationship w/Latinos https://t…"
"Obama in Japan today: Hillary Clinton and Bernie Sanders need to “stick to the issues"" https://t.co/uJaECOZe66"
"This is the @WSJ graphic that was featured on MSNBC just now -- Red Feed, Blue Feed:
https://t.co/eo9QwTt1e2 https://t.co/ISIpSObB0x"
"By a 32-pt margin, voters rated Trump as better equipped than Clinton to change business as usual in Washington https://t.co/9p4ViyF4l6"
Search Hillary Clinton's emails from the time when she was secretary of state: https://t.co/iDpUCypGcH
"Capital Journal Daybreak: Today on the Campaign Trail, More https://t.co/yci3dnLXTi"
A new Senate bill would force Donald Trump to release his tax returns https://t.co/O8TafsSLed by @siobhanehughes
Oil industry executives are eager to hear more about Donald Trump's energy policy today https://t.co/PPHlCUEbpZ
Donald Trump to Address North Dakota’s Oil Industry https://t.co/g26q2jiNj2
Sen. Ron Wyden introduces legislation to target Donald Trump's tax returns https://t.co/UWhRfuDElf
"Voters see Donald Trump as best able to change Washington and improve economy, poll shows https://t.co/yRS1aB839w"
Paul Ryan still hasn’t decided whether to endorse presumptive GOP nominee Donald Trump https://t.co/0xhP5zJtkQ https://t.co/5dKZrOE1dI
"In Congress, the buzz is turning to speculation over vice presidents https://t.co/TZTkOqjGoR https://t.co/TEzlBMbcLJ"
A drop in support for Hillary Clinton has magnified Donald Trump's rise in polls.  https://t.co/nR0GrlBSRj https://t.co/WAXfNYWEiM
"Judge rejects law placing limits on early voting in Ohio, finding 2014 state law depressed African-American voting. https://t.co/Tu6GhaIP3Q"
The Capitol Hill VP speculation machine is only beginning to kick into gear https://t.co/0v1WTLbREL
Rick Santorum warns Donald Trump against shifting on ethanol https://t.co/I0lNPeFDk8
Video: @GeraldFSeib explains what voters' disdain of Hillary Clinton and Donald Trump means for the general election https://t.co/HlmUViydcW
"Jets owner, other longtime Republican fundraisers join Donald Trump-RNC fundraising effort https://t.co/35GAokJ3pI"
D.C. appeals court set to determine fate of several Obama initiatives while Supreme Court is short-handed https://t.co/QP80WGp7Kp
Department of Veterans Affairs has mistakenly declared thousands of veterans to be dead and canceled their benefits https://t.co/L3PQpTHvyS
There's no shortage of possible vice presidents on Capitol Hill these days https://t.co/3T9pTw6G9r
"Eleven states, led by Texas, are suing the Obama administration over a its new transgender bathroom policy https://t.co/sRQBEtvsTM"
Sen. Ron Wyden introduces legislation to target Donald Trump's tax returns https://t.co/SJwzhbB8hO
Donald Trump’s National Political Director Leaves Campaign https://t.co/TDCsmpEMtx
"New findings in Clinton report:
1. State found another missing email.
2. There were intrusion attempts made.
More:
https://t.co/TikY2QL2ZO"
RT @randyyeipWSJ: Sanders outperforms Clinton against Trump. Why? https://t.co/6QK42xVAhc https://t.co/QivqHuzkEC
Search Hillary Clinton's emails from the time when she was secretary of state: https://t.co/qrZh7rkTvo
Five revelations from the watchdog report on Hillary Clinton's email use: https://t.co/f4TUA2afAZ
Profiting from politics proves challenging for startups https://t.co/G40vDRDPNS
Doug Heye: How Donald Trump's attack on Gov. Susana Martinez undermines the GOP--and Donald Trump https://t.co/r4b2aF7QF8 via @wsjthinktank
How Donald Trump’s Attack on Susana Martinez Undermines the GOP–and Trump https://t.co/G2k9wV6HWC
Paul Ryan and Donald Trump are scheduled to speak by phone tonight. Latest: https://t.co/lyLvOS4n9Y
Exxon and Chevron shareholders narrowly reject climate-change stress tests    https://t.co/J4DCtqfYLE
RT @WSJThinkTank: How Donald Trump's attack on Gov. Susana Martinez undermines the GOP--and Donald Trump: https://t.co/ckttyF3iaN https://t…
"Thousands of living vets declared dead, lose benefits in past five years https://t.co/ewoheNKbDC"
"RT @laurameckler: Protesters outside Clinton event in Salinas chant ""not with her!"" https://t.co/DgX2SXjr3N"
Hillary Clinton allies express worry over facing an unpredictable Donald Trump in the general election https://t.co/G3wFyWM1r9
Clinton Emails: 5 Revelations From the Watchdog Report https://t.co/fiatbqvDCZ
How the U.S. tracked and killed the leader of the Taliban https://t.co/dksnLyaRck by @adamentous @jessdonati
Paul Ryan still hasn’t decided whether to endorse presumptive GOP nominee Donald Trump https://t.co/eLFtWby93w https://t.co/v6TzRPaHLu
RT @gonzowsj: House's Puerto Rico bill takes aim at the minimum wage and new federal overtime-pay rules https://t.co/NRe4S3p6uZ https://t.c…
Rick Santorum Warns Donald Trump Against Shifting on Ethanol https://t.co/O9wko7HD29
"RT @reidepstein: Ethanol - it's not just for Iowa anymore! 

Santorum tells Trump to stand strong in support of the RFS https://t.co/8A3OUW…"
"In fresh attack, Elizabeth Warren calls Trump a ""small, insecure money grubber who doesn’t care who gets hurt"" https://t.co/UAX3YM0ViY"
A drop in support for Hillary Clinton has magnified Donald Trump's rise in polls.  https://t.co/W2VjcJdyIw https://t.co/yxj8gPXvp4
"RT @GlennHall: Dept of Veterans Affairs has declared thousands of living vets dead, causing them to lose benefits https://t.co/rKCXp5Fsgp v…"
A new Senate bill would force Donald Trump to release his tax returns https://t.co/5WaCDg2ohC by @siobhanehughes
"Elizabeth Warren: ""Donald Trump was drooling over the idea of a housing meltdown"" https://t.co/gyJy5dyPVJ"
"State Department security staff “did not—and would not—approve"" Hillary Clinton's email practices, report says  https://t.co/ag7dyFgsWI"
"RT @siobhanehughes: Ryan: ""I haven't made a decision"" on whether to endorse Donald Trump."
RT @kristinapet: There's no shortage of possible vice presidents on Capitol Hill these days https://t.co/8DAa8lnH8C via @WSJPolitics https:…
"RT @JamesVGrimaldi: Report contradicts Hillary Clinton's campaign website, says she failed to show email practices met minimum security. ht…"
Elizabeth Warren unleashed new attacks on Donald Trump last night. Our writeup: https://t.co/SMWBYbSis0
Senate Bill Would Force Donald Trump to Release Tax Returns https://t.co/U6RbeawOSp
"In Congress, the buzz is turning to speculation over vice presidents https://t.co/70G3HVxFeJ https://t.co/ag8G5xw7Py"
"RT @siobhanehughes: Pelosi: ""I do think that this unease says that this party should revisit the delegate selection process."""
"Search Hillary Clinton's emails, in our @wsj database: https://t.co/b9xe7ET5U2"
RT @felschwartz: @kristinapet on the VP speculation that's enthralled Capitol Hill https://t.co/iShlSxikGD
"RT @JeanneCummings: Sharing a moment: In Congress, there are many vice presidents     https://t.co/hMWrMG0TtF via @WSJ"
"RT @felschwartz: Clinton's email practices violated State Dept policy, OIG report reveals. @ByronTau w/ an early look https://t.co/94otPOxr…"
New: Watchdog report says Hillary Clinton's email practices at State Department violated policy https://t.co/NEW1USC4NU
What concerns Hillary Clinton allies about the general election https://t.co/eDRnrVIZkM
Obama to use Indiana visit June 1 to highlight the economy’s rebound https://t.co/0i6BzOh6lm
Polls: Clinton's drop has magnified Trump's rise https://t.co/ZCqEymykx9
RT @TimJHanrahan: Tighter race: Hillary Clinton's drop has magnified Donald Trump's rise https://t.co/9BdrwpfVq9 by @randyyeipWSJ https://t…
The House's Puerto Rico bill takes aim at the minimum wage and new federal overtime-pay rules https://t.co/dYuiUcFe3y
President Obama suggests U.S. won't make 'mistake' of electing Donald Trump https://t.co/mit1WwfUpw
Ellen DeGeneres helps Hillary Clinton pick a VP -- and it's not Bernie Sanders https://t.co/tZGSePYuPi
"Capital Journal Daybreak: Today on the Campaign Trail, More https://t.co/Z83LJk6y0k"
RT @heatherhaddon: Donald Trump and Hillary Clinton aren't the popular kids @WSJPolitics  https://t.co/6E7IVBJhrG
Hillary Clinton allies express worry over facing 'Wild Trump' in general election https://t.co/hICbXclPVQ
Donald Trump’s Unpredictability Concerns Clinton Allies https://t.co/U0kTRD0ThK
Polls: Clinton’s Drop Has Magnified Trump’s Rise https://t.co/U6a60h1Yo6
Hillary Clinton &amp; Donald Trump would start the general election as the two most unpopular nominees in recent history https://t.co/77ptEvrIG5
"Obama's approval rating is above 50%, for the first time in years. Good news for Clinton? https://t.co/5rwkmUjNTK https://t.co/tKpIkL9psP"
"The U.S. is lifting a decadeslong ban on arms sales to Vietnam, in a bid to normalize relations https://t.co/jkjPN33yUR"
U.S. to lift a decades-old ban on sales of lethal arms to Vietnam  https://t.co/8FwyYebchV
Obama Suggests U.S. Won’t Make ‘Mistake’ of Electing Trump https://t.co/AunqXNsgJ1
Big U.S. insurers would face tougher capital requirements than peers under new rules outlined by the Fed’s Tarullo https://t.co/XI1EPQEHuT
Divisions within the Democratic Party have thrust Harry Reid into the center of an intraparty brawl https://t.co/2HBuKOF2q8
Ellen DeGeneres Helps Hillary Clinton Pick a VP https://t.co/JQDEHoJ98x
Elizabeth Warren Steps Up Attacks on Donald Trump https://t.co/4N8s6GoM4U
Facebook is revamping its trending topics feature amid bias fears https://t.co/oePwBWTWlM
Obama to Use Indiana Visit to Highlight Economy’s Rebound https://t.co/aHVzvAstqA
Video: WSJ's @GeraldFSeib offers two reasons predictions about VP picks are likely wrong right now https://t.co/SN0qW8yeMf
"Temp workers are plentiful in the South, but paid better in the West. See where your state ranks: https://t.co/IgEIv9Llyq"
How Donald Trump lags behind Hillary Clinton in organizing key state of Ohio        https://t.co/RNbHdFxB2l
President Obama voiced human-rights concerns in Vietnam visit https://t.co/kXCQq97kFW
Hillary Clinton ad accuses Donald Trump of rooting for the U.S. housing collapse https://t.co/EhAa32kX2U
How the U.S. tracked and killed the leader of the Taliban https://t.co/zSoKDjOyL1 by @adamentous @jessdonati
"WSJ/NBC Poll finds a plurality support transgender bathroom choice, want government out https://t.co/95ENQ1UlwQ"
Bernie Sanders wants vote count reviewed in tight Kentucky race https://t.co/d68K49mHPL  by @laurameckler https://t.co/jJnaPh4vci
Bernie Sanders wants votes reviewed in tight Kentucky race https://t.co/y0tIqG0abU
Longtime Republican Backers Join Donald Trump-RNC Fundraising Effort https://t.co/KWAPHhII2G
"Donald Trump paid the ""lowest tax rate possible,"" his campaign manager said Tuesday.  https://t.co/9XTdY0QOdl"
"RT @rebeccaballhaus: Every fundraiser who joined Trump Victory as a ""vice chairman"" previously backed a candidate who wasn't Trump: https:/…"
RT @GlennHall: Every vice chairman on the list has previously backed a presidential candidate who was not @realDonaldTrump  https://t.co/T5…
Bernie Sanders Wants Votes Reviewed in Tight Kentucky Race https://t.co/irACKrsnPn
Is delegate math a factor in Bernie Sanders's opposition to Puerto Rico debt deal? https://t.co/iOLT7y3zSa by @jamespmanley @WSJThinkTank
"With Hillary Clinton's shifting her focus to Donald Trump, a long primary debate season officially ends https://t.co/mZZSzuFHqy"
